PassengerId,Pclass,Name,Sex,Age,SibSp,Parch,Ticket,Fare,Cabin,Embarked,Survived
797,1,"Leader, Dr. Alice (Farnham)",0,49,0,0,17465,25.9292,D,S,1
798,3,"Osman, Mrs. Mara",0,31,0,0,349244,8.6833,G,S,1
799,3,"Ibrahim Shawah, Mr. Yousseff",1,30,0,0,2685,7.2292,G,C,0
800,3,"Van Impe, Mrs. Jean Baptiste (Rosalie Paula Govaert)",0,30,1,1,345773,24.15,F,S,0
801,2,"Ponesell, Mr. Martin",1,34,0,0,250647,13,G,S,0
802,2,"Collyer, Mrs. Harvey (Charlotte Annie Tate)",0,31,1,1,C.A. 31921,26.25,F,S,1
803,1,"Carter, Master. William Thornton II",1,11,1,2,113760,120,B,S,1
804,3,"Thomas, Master. Assad Alexander",1,0.42,0,1,2625,8.5167,G,C,1
805,3,"Hedman, Mr. Oskar Arvid",1,27,0,0,347089,6.975,G,S,1
806,3,"Johansson, Mr. Karl Johan",1,31,0,0,347063,7.775,G,S,0
807,1,"Andrews, Mr. Thomas Jr",1,39,0,0,112050,0,A,S,0
808,3,"Pettersson, Miss. Ellen Natalia",0,18,0,0,347087,7.775,G,S,0
809,2,"Meyer, Mr. August",1,39,0,0,248723,13,G,S,0
810,1,"Chambers, Mrs. Norman Campbell (Bertha Griggs)",0,33,1,0,113806,53.1,E,S,1
811,3,"Alexander, Mr. William",1,26,0,0,3474,7.8875,G,S,0
812,3,"Lester, Mr. James",1,39,0,0,A/4 48871,24.15,F,S,0
813,2,"Slemen, Mr. Richard James",1,35,0,0,28206,10.5,G,S,0
814,3,"Andersson, Miss. Ebba Iris Alfrida",0,6,4,2,347082,31.275,T,S,0
815,3,"Tomlin, Mr. Ernest Portage",1,30.5,0,0,364499,8.05,G,S,0
816,1,"Fry, Mr. Richard",1,,0,0,112058,0,B,S,0
817,3,"Heininen, Miss. Wendla Maria",0,23,0,0,STON/O2. 3101290,7.925,G,S,0
818,2,"Mallet, Mr. Albert",1,31,1,1,S.C./PARIS 2079,37.0042,T,C,0
819,3,"Holm, Mr. John Fredrik Alexander",1,43,0,0,C 7075,6.45,G,S,0
820,3,"Skoog, Master. Karl Thorsten",1,10,3,2,347088,27.9,T,S,0
821,1,"Hays, Mrs. Charles Melville (Clara Jennings Gregg)",0,52,1,1,12749,93.5,B,S,1
822,3,"Lulic, Mr. Nikola",1,27,0,0,315098,8.6625,G,S,1
823,1,"Reuchlin, Jonkheer. John George",1,38,0,0,19972,0,G,S,0
824,3,"Moor, Mrs. (Beila)",0,27,0,1,392096,12.475,E,S,1
825,3,"Panula, Master. Urho Abraham",1,2,4,1,3101295,39.6875,A,S,0
826,3,"Flynn, Mr. John",1,,0,0,368323,6.95,G,Q,0
827,3,"Lam, Mr. Len",1,,0,0,1601,56.4958,C,S,0
828,2,"Mallet, Master. Andre",1,1,0,2,S.C./PARIS 2079,37.0042,T,C,1
829,3,"McCormack, Mr. Thomas Joseph",1,,0,0,367228,7.75,G,Q,1
830,1,"Stone, Mrs. George Nelson (Martha Evelyn)",0,62,0,0,113572,80,B,C,1
831,3,"Yasbeck, Mrs. Antoni (Selini Alexander)",0,15,1,0,2659,14.4542,G,C,1
832,2,"Richards, Master. George Sibley",1,0.83,1,1,29106,18.75,F,S,1
833,3,"Saad, Mr. Amin",1,,0,0,2671,7.2292,G,C,0
834,3,"Augustsson, Mr. Albert",1,23,0,0,347468,7.8542,G,S,0
835,3,"Allum, Mr. Owen George",1,18,0,0,2223,8.3,G,S,0
836,1,"Compton, Miss. Sara Rebecca",0,39,1,1,PC 17756,83.1583,E,C,1
837,3,"Pasic, Mr. Jakob",1,21,0,0,315097,8.6625,G,S,0
838,3,"Sirota, Mr. Maurice",1,,0,0,392092,8.05,G,S,0
839,3,"Chip, Mr. Chang",1,32,0,0,1601,56.4958,C,S,1
840,1,"Marechal, Mr. Pierre",1,,0,0,11774,29.7,C,C,1
841,3,"Alhomaki, Mr. Ilmari Rudolf",1,20,0,0,SOTON/O2 3101287,7.925,G,S,0
842,2,"Mudd, Mr. Thomas Charles",1,16,0,0,S.O./P.P. 3,10.5,G,S,0
843,1,"Serepeca, Miss. Augusta",0,30,0,0,113798,31,T,C,1
844,3,"Lemberopolous, Mr. Peter L",1,34.5,0,0,2683,6.4375,G,C,0
845,3,"Culumovic, Mr. Jeso",1,17,0,0,315090,8.6625,G,S,0
846,3,"Abbing, Mr. Anthony",1,42,0,0,C.A. 5547,7.55,G,S,0
847,3,"Sage, Mr. Douglas Bullen",1,,8,2,CA. 2343,69.55,C,S,0
848,3,"Markoff, Mr. Marin",1,35,0,0,349213,7.8958,G,C,0
849,2,"Harper, Rev. John",1,28,0,1,248727,33,T,S,0
850,1,"Goldenberg, Mrs. Samuel L (Edwiga Grabowska)",0,,1,0,17453,89.1042,C,C,1
851,3,"Andersson, Master. Sigvard Harald Elias",1,4,4,2,347082,31.275,T,S,0
852,3,"Svensson, Mr. Johan",1,74,0,0,347060,7.775,G,S,0
853,3,"Boulos, Miss. Nourelain",0,9,1,1,2678,15.2458,G,C,0
854,1,"Lines, Miss. Mary Conover",0,16,0,1,PC 17592,39.4,D,S,1
855,2,"Carter, Mrs. Ernest Courtenay (Lilian Hughes)",0,44,1,0,244252,26,F,S,0
856,3,"Aks, Mrs. Sam (Leah Rosen)",0,18,0,1,392091,9.35,G,S,1
857,1,"Wick, Mrs. George Dennick (Mary Hitchcock)",0,45,1,1,36928,164.8667,B,S,1
858,1,"Daly, Mr. Peter Denis ",1,51,0,0,113055,26.55,E,S,1
859,3,"Baclini, Mrs. Solomon (Latifa Qurban)",0,24,0,3,2666,19.2583,F,C,1
860,3,"Razi, Mr. Raihed",1,,0,0,2629,7.2292,G,C,0
861,3,"Hansen, Mr. Claus Peter",1,41,2,0,350026,14.1083,G,S,0
862,2,"Giles, Mr. Frederick Edward",1,21,1,0,28134,11.5,G,S,0
863,1,"Swift, Mrs. Frederick Joel (Margaret Welles Barron)",0,48,0,0,17466,25.9292,D,S,1
864,3,"Sage, Miss. Dorothy Edith ""Dolly""",0,,8,2,CA. 2343,69.55,C,S,0
865,2,"Gill, Mr. John William",1,24,0,0,233866,13,G,S,0
866,2,"Bystrom, Mrs. (Karolina)",0,42,0,0,236852,13,G,S,1
867,2,"Duran y More, Miss. Asuncion",0,27,1,0,SC/PARIS 2149,13.8583,G,C,1
868,1,"Roebling, Mr. Washington Augustus II",1,31,0,0,PC 17590,50.4958,A,S,0
869,3,"van Melkebeke, Mr. Philemon",1,,0,0,345777,9.5,G,S,0
870,3,"Johnson, Master. Harold Theodor",1,4,1,1,347742,11.1333,G,S,1
871,3,"Balkic, Mr. Cerin",1,26,0,0,349248,7.8958,G,S,0
872,1,"Beckwith, Mrs. Richard Leonard (Sallie Monypeny)",0,47,1,1,11751,52.5542,D,S,1
873,1,"Carlsson, Mr. Frans Olof",1,33,0,0,695,5,B,S,0
874,3,"Vander Cruyssen, Mr. Victor",1,47,0,0,345765,9,G,S,0
875,2,"Abelson, Mrs. Samuel (Hannah Wizosky)",0,28,1,0,P/PP 3381,24,F,C,1
876,3,"Najib, Miss. Adele Kiamie ""Jane""",0,15,0,0,2667,7.225,G,C,1
877,3,"Gustafsson, Mr. Alfred Ossian",1,20,0,0,7534,9.8458,G,S,0
878,3,"Petroff, Mr. Nedelio",1,19,0,0,349212,7.8958,G,S,0
879,3,"Laleff, Mr. Kristo",1,,0,0,349217,7.8958,G,S,0
880,1,"Potter, Mrs. Thomas Jr (Lily Alexenia Wilson)",0,56,0,1,11767,83.1583,C,C,1
881,2,"Shelley, Mrs. William (Imanita Parrish Hall)",0,25,0,1,230433,26,F,S,1
882,3,"Markun, Mr. Johann",1,33,0,0,349257,7.8958,G,S,0
883,3,"Dahlberg, Miss. Gerda Ulrika",0,22,0,0,7552,10.5167,G,S,0
884,2,"Banfield, Mr. Frederick James",1,28,0,0,C.A./SOTON 34068,10.5,G,S,0
885,3,"Sutehall, Mr. Henry Jr",1,25,0,0,SOTON/OQ 392076,7.05,G,S,0
886,3,"Rice, Mrs. William (Margaret Norton)",0,39,0,5,382652,29.125,T,Q,0
887,2,"Montvila, Rev. Juozas",1,27,0,0,211536,13,G,S,0
888,1,"Graham, Miss. Margaret Edith",0,19,0,0,112053,30,B,S,1
889,3,"Johnston, Miss. Catherine Helen ""Carrie""",0,,1,2,W./C. 6607,23.45,F,S,0
890,1,"Behr, Mr. Karl Howell",1,26,0,0,111369,30,C,C,1
891,3,"Dooley, Mr. Patrick",1,32,0,0,370376,7.75,G,Q,0
